{
  "schema_version": "1.0",
  "adapter_id": "l2-3e3b26a92fe1--littlealterboy",
  "family_id": "3e3b26a92fe1",
  "identity": {
    "vendor": "SoundToys",
    "product": "LittleAlterBoy",
    "version_range": "5.0.1.0",
    "formats": [
      "VST2"
    ],
    "availability": "current-filesystem-match",
    "tested_host": "deferred / not L3"
  },
  "capabilities": {
    "primary": "pitch-formant-creative",
    "secondary": [],
    "diagnoses": [
      "creative_octave_layer",
      "formant_character",
      "robotic_voice"
    ],
    "not_for": []
  },
  "routing": [
    {
      "position": "复制轨或 Aux 100% Wet。",
      "when": "creative_octave_layer"
    },
    {
      "position": "主唱自动化只用于明确片段并保留回退。",
      "when": "creative_octave_layer"
    }
  ],
  "parameter_strategy": {
    "targets": [
      "角色层可辨但不抢主唱中心。",
      "辅音和齿音不产生明显算法碎裂。"
    ],
    "controls": [
      {
        "name": "Pitch",
        "action": "低八度 -12；和声先按调性确认间隔。"
      },
      {
        "name": "Formant",
        "action": "下移 1–3 作为增厚起点；大移调时同向小调以增自然。"
      },
      {
        "name": "Transpose / Quantize / Robot",
        "action": "角色层用 Transpose；硬调音谨慎 Quantize；Drone 用 Robot。"
      },
      {
        "name": "Drive / Mix",
        "action": "先 Drive 0 判断算法，再小加；角色层多用 100% Wet。"
      }
    ],
    "no_universal_values": true
  },
  "input_requirements": [
    "explicitly accept L2/deferred evidence",
    "level-matched comparison"
  ],
  "risks": [
    "Quantize 当调内校音。",
    "处理立体声复调 Stem。",
    "主轨全湿。",
    "Drive 掩盖算法伪影。"
  ],
  "stop_conditions": [
    "角色清晰且在 Mono/小音箱仍支持主体。",
    "继续移调只增加伪影时停止。"
  ],
  "alternatives": [],
  "version_policy": {
    "match": "L2 control knowledge only; no L3 host guarantee.",
    "mismatch": "Suppress exact controls and require revalidation."
  },
  "evidence": {
    "level": "L2",
    "card": "C:\\Projects\\aizen-knowledge-base\\notes\\音乐制作\\插件\\SoundToys\\LittleAlterBoy.md",
    "source_note": "C:\\Projects\\aizen-knowledge-base\\sources\\音乐制作\\插件资料\\SoundToys\\LittleAlterBoy资料.md",
    "validation_report": "not-L3",
    "result_files": [],
    "packaged": {
      "card": {
        "packaged_path": "p1/evidence/supplemental/cards/LittleAlterBoy.md",
        "sha256": "3980aa73382bc1716fddb7fd42c48463c15a68d3293c0c8130a1cd932915ad6a"
      },
      "source_note": {
        "packaged_path": "p1/evidence/supplemental/sources/LittleAlterBoy资料.md",
        "sha256": "83f5ba6082e17b9e77ff821fa52a43f6b54fa71587f5ebe9b5cd6ccc045d9228"
      }
    }
  },
  "p0_contract": {
    "diagnosis_inputs": [
      "creative_octave_layer",
      "formant_character",
      "robotic_voice"
    ],
    "outputs": [
      "plugin",
      "route",
      "parameter_targets",
      "stop_conditions",
      "side_effects",
      "retest_metrics"
    ]
  },
  "conflict_rules": [],
  "validation": {
    "status": "deferred-l2",
    "matrix_status": "not-l3",
    "boundary": "Official/control research only; no successful L3 host render."
  },
  "catalog_warnings": [
    "evidence_level_l2_not_l3",
    "vst2_host_validation_deferred"
  ],
  "local_guidance": {
    "signal_position": [
      "通常复制主唱/Ad-lib 到独立轨后处理，避免破坏主唱。",
      "移调后再 EQ、去齿、压缩和空间，因为算法会改变频谱/辅音。"
    ],
    "routing": [
      "复制轨或 Aux 100% Wet。",
      "主唱自动化只用于明确片段并保留回退。"
    ],
    "controls": [
      {
        "name": "Pitch",
        "meaning": "以半音移动音高或在 Robot 定义固定音。",
        "action": "低八度 -12；和声先按调性确认间隔。"
      },
      {
        "name": "Formant",
        "meaning": "改变声道共振峰与角色。",
        "action": "下移 1–3 作为增厚起点；大移调时同向小调以增自然。"
      },
      {
        "name": "Transpose / Quantize / Robot",
        "meaning": "连续移调、半音硬吸附、固定音。",
        "action": "角色层用 Transpose；硬调音谨慎 Quantize；Drone 用 Robot。"
      },
      {
        "name": "Drive / Mix",
        "meaning": "管式饱和与干湿。",
        "action": "先 Drive 0 判断算法，再小加；角色层多用 100% Wet。"
      }
    ],
    "parameter_start_points": [
      "低八度：Pitch -12、Formant -1 至 -3、Drive 0、Mix 100%。",
      "仅增厚：Pitch 0、Formant -1 至 -3、Mix 10–30% 或复制轨低音量。",
      "Quantize+Drive 只用于可听效果。"
    ],
    "listen_for": [
      "复调/混响导致颤抖。",
      "低八度浑浊、Formant 过度怪异。",
      "Dry/Wet 相干梳状。"
    ],
    "stop": [
      "角色清晰且在 Mono/小音箱仍支持主体。",
      "继续移调只增加伪影时停止。"
    ],
    "latency": [
      "官方手册未给 v5.0.1 VST2 延迟；Pitch 算法和 Mix 必须 S4 测。"
    ]
  }
}
